id,title,venue_id,n_citations
0,Training Region-based Object Detectors with Online Hard Example Mining,0,4
1,NeRS: Neural Reflectance Surfaces for Sparse-View 3D Reconstruction in the Wild,1,2
2,Actions ~ Transformations,0,1
3,ViSER: Video Surface Embeddings for Articulated 3D Shape Reconstruction,1,1
4,Learning to Segment Rigid Motions from Two Frames,0,0
5,GLASS: Geometric Latent Augmentation for Shape Spaces,0,0
6,DECOR-GAN: 3D Shape Detailization by Conditional Refinement,0,1
7,Generalizing Across Domains via Cross-Gradient Training,2,0
