id,title,year,venue_id
78158,Proceedings of the first european conference on Computer vision,1990,1
78162,On scale and resolution in the analysis of local image structure,1990,1
78163,Optimal filter for edge detection methods and results,1990,1
78165,Biased anisotropic diffusion—a unified regularization and diffusion approach to edge detection,1990,1
78166,Hierarchical image analysis using irregular tessellations,1990,1
78167,A bit plane architecture for an image analysis processor implemented with P.L.C.A. gate array,1990,1
78169,Scale-space singularities,1990,1
78170,Recursive filtering and edge closing: two primary tools for 3-D edge detection,1990,1
78172,Edge contours using multiple scales,1990,1
78174,Stereo integration, mean field theory and psychophysics,1990,1
78175,A pyramidal stereovision algorithm based on contour chain points,1990,1
78176,Parallel and deterministic algorithms from MRFs: surface reconstruction and integration,1990,1
78177,Parallel multiscale stereo matching using adaptive smoothing,1990,1
78179,On the motion of 3-D curves and its relationship to optical flow,1990,1
78181,Structure-from-motion under orthographic projection,1990,1
78182,Parallel computation of optic flow,1990,1
78183,Obstacle detection by evaluation of optical flow fields,1990,1
78184,Extending the `oriented smoothness constraint' into the temporal domain and the estimation of derivatives of optical flow,1990,1
78187,A comparison of stochastic and deterministic solution methods in Bayesian estimation of 2-D motion,1990,1
78190,Motion determination in space-time images,1990,1
78191,Ambiguity in reconstruction from image correspondences,1990,1
78193,An optimal solution for mobile camera calibration,1990,1
78194,Analytical results on error sensitivity of motion estimation from two views,1990,1
78195,On the estimation of depth from motion using an anthropomorphic visual sensor,1990,1
78197,The derivation of qualitative information in motion analysis,1990,1
78198,Road following algorithm using a panned plan-view transformation,1990,1
78199,3-D-vision-based robot navigation: first steps,1990,1
78200,Dynamic world modeling using vertical line stereo,1990,1
78202,Tracking in a complex visual environment,1990,1
78204,Tracking line segments,1990,1
78205,Measurement and integration of 3-D structures by tracking edge lines,1990,1
78208,Estimation of 3-D motion and structure from tracking 2-D lines in a sequence of images,1990,1
78209,The incremental rigidity scheme for structure from motion: the line-based formulation,1990,1
78210,Object detection using model based prediction and motion parallax,1990,1
78211,Detection and tracking of moving objects based on a statistical regularization method in space and time,1990,1
78212,Vertical and horizontal disparities from phase,1990,1
78213,Stereo correspondence from optic flow,1990,1
78214,A model for the estimate of local image velocity,1990,1
78215,Direct evidence for occlusion in stereo and motion,1990,1
78217,On the use of trajectory information to assist stereopsis in a dynamic environment,1990,1
78220,Distributed learning of texture classification,1990,1
78222,Fast shape from shading,1990,1
78223,Inverse perspective of a triangle: new exact and approximate solutions,1990,1
78224,Finding geometric and relational structures in an image,1990,1
78225,Recovery of volumetric object descriptions from laser rangefinder images,1990,1
78227,Extraction of deformable part models,1990,1
78228,Toward a computational theory of shape: an overview,1990,1
78229,Stabilized solution for 3-D model parameters,1990,1
78231,Deformable templates for features extraction from medical images,1990,1
78232,Changing surface structure,1990,1
78234,Projectively invariant representations using implicit algebraic curves,1990,1
78235,Shape from contour using symmetries,1990,1
78236,Using occluding contours for 3-D object modeling,1990,1
78237,Robust estimation of surface curvature from deformation of parent contours,1990,1
78239,Spatial localization of modelled objects of revolution in monocular perspective vision,1990,1
78242,On the verification of hypothesized matches in model-based recognition,1990,1
78244,Object recognition using local geometric constraints: a robust alternative to tree-search,1990,1
78247,SIMD geometric matching,1990,1
78250,A 3-D interpretation system based on consistent labeling of a set of propositions—application to the interpretation of straight line correspondences,1990,1
78251,Model-based object recognition by geometric hashing,1990,1
78252,An analysis of knowledge representation schemes for high level vision,1990,1
78254,Experiments on the use of the ATMS to label features for object recognition,1990,1
78256,The combinatorics of heuristic search termination for object recognition,1990,1
78257,Combinatorial characterization of perspective projections from polyhedral object scenes,1990,1
78259,Estimation of curvature in 3-D images using tensor field filtering,1990,1
78261,Transparent-motion analysis,1990,1
78262,Snake growing,1990,1
78264,Local cross-modality image alignment using unsupervised learning,1990,1
78265,A heterogeneous vision architecture,1990,1
78267,Spatial context in an image analysis system,1990,1
78271,Object detection and identification by hierarchical segmentation,1990,1
78273,Shading into texture and texture into shading: an active approach,1990,1
78274,3-D curve matching using splines,1990,1
78276,The dynamic generalized Hough transform,1990,1
78277,The analysis of time varying image sequences,1990,1
78279,On the use of motion concepts for top-down control in traffic scenes,1990,1
78339,Final steps towards real time trinocular stereovision,1990,1
78340,B-spline contour representation and symmetry detection,1990,1
78341,Using neural networks to learn shape decomposition by successive prototypication,1990,1
78342,Shape and mutual cross-ratios with applications to exterior, interior and relative orientation,1990,1
78343,Adapting computer vision systems to the visual environment: topographic mapping,1990,1
78345,Stereo matching based on a combination of simple features used for matching in temporal image sequences,1990,1
92957,EMPATH: face, emotion, and gender recognition using holons,1990,5
105537,Proceedings of the 1990 conference on Advances in neural information processing systems 3,1990,5
105538,Studies of a model for the development and regeneration of eye-brain maps,1990,5
105539,Development and spatial structure of cortical feature maps: a model study,1990,5
105540,Interaction among ocularity, retinotopy and on-center/off-center pathways during development,1990,5
105541,Simple spin models for the development of ocular dominance columns and iso-orientation patches,1990,5
105542,A recurrent neural network model of velocity storage in the vestibulo-ocular reflex,1990,5
105543,Self-organization of Hebbian synapses in Hippocampal neurons,1990,5
105544,Cholinergic modulation may enhance cortical associative memory function,1990,5
105545,Order reduction for dynamical systems describing the behavior of complex neurons,1990,5
105546,Stochastic neurodynamics,1990,5
105547,Dynamics of learning in recurrent feature-discovery networks,1990,5
105548,A Lagrangian approach to fixed points,1990,5
105549,Associative memory in a network of biological neurons,1990,5
105550,CAM storage of analog patterns and continuous sequences with 3N2 weights,1990,5
105551,Connection topology and dynamics in lateral inhibition networks,1990,5
105552,Shaping the state space landscape in recurrent networks,1990,5
105553,Adjoint-functions and temporal learning algorithms in neural networks,1990,5
105554,Phase-coupling in two-dimensional networks of interacting oscillators,1990,5
105555,Oscillation onset in neural delayed feedback,1990,5
105556,Analog computation at a critical point: a novel function for neuronal oscillations?,1990,5
105557,Modeling time varying system using hidden control neural architecture,1990,5
105558,The Tempo 2 algorithm: adjusting time-delays by supervised learning,1990,5
105559,A theory for neural networks with time delays,1990,5
105560,ART2/BP architecture for adaptive estimation of dynamic processes,1990,5
105561,Statistical mechanics of temporal association in neural networks with delayed interactions,1990,5
105562,Learning time-varying concepts,1990,5
105563,The recurrent cascade-correlation architecture,1990,5
105564,Continuous speech recognition by linked predictive neural networks,1990,5
105565,A recurrent neural network for word identification from continuous phoneme strings,1990,5
105566,Connectionist approaches to the use of Markov models for speech recognition,1990,5
105567,Spoken letter recognition,1990,5
105568,Speech recognition using demi-syllable neural prediction model,1990,5
105569,RecNorm: Simultaneous normalisation and classification applied to speech recognition,1990,5
105570,Exploratory feature extraction in speech signals,1990,5
105571,Phonetic classification and recognition using the multi-layer perceptron,1990,5
105572,From speech recognition to spoken language understanding: the development of the MIT SUMMIT and VOYAGER systems,1990,5
105573,Speech recognition using connectionist approaches,1990,5
105574,Natural dolphin echo recognition using an integrator gateway network,1990,5
105575,Signal processing by multiplexing and demultiplexing in neurons,1990,5
105576,Applications of neural networks in video signal processing,1990,5
105577,Discovering viewpoint-invariant relationships that characterize objects,1990,5
105578,A neural network approach for three-dimensional object recognition,1990,5
105579,A second-order translation, rotation and scale invariant neural network,1990,5
105580,Learning to see rotation and dilation with a Hebb rule,1990,5
105581,Stereopsis by neural network which learns the constraints,1990,5
105582,Grouping contours by iterated pairing network,1990,5
105583,Neural dynamics of motion segmentation and grouping,1990,5
105584,A multiscale adaptive network model of motion computation in primates,1990,5
105585,Qualitative structure from motion,1990,5
105586,Optimal sampling of natural images: a design principle for the visual system?,1990,5
105588,A VLSI neural network for color constancy,1990,5
105590,Optimal filtering in the salamander retina,1990,5
105592,A four neuron circuit accounts for change sensitive inhibition in salamander retina,1990,5
105593,Feedback synapse to cone and light adaptation,1990,5
105594,An analog VLSI chip for finding edges from zero-crossings,1990,5
105595,A delay-line based motion detection chip,1990,5
105597,Neural networks structured for control application to aircraft landing,1990,5
105598,Real-time autonomous robot navigation using VLSI neural networks,1990,5
105600,Rapidly adapting artificial neural networks for autonomous navigation,1990,5
105601,Learning trajectory and force control of an artificial muscle arm by parallel-hierarchical neural network model,1990,5
105603,Proximity effect corrections in electron beam lithography using a neural network,1990,5
105604,Planning with an adaptive world model,1990,5
105605,A connectionist learning control architecture for navigation,1990,5
105607,Navigating through temporal difference,1990,5
105608,Integrated modeling and control based on reinforcement learning and dynamic programming,1990,5
105609,A reinforcement learning variant for control scheduling,1990,5
105610,Adaptive range coding,1990,5
105611,Neural network implementation of admission control,1990,5
105612,Reinforcement learning in Markovian and non-Markovian environments,1990,5
105615,A model of distributed sensorimotor control in the cockroach escape turn,1990,5
105617,Flight control in the dragonfly: a neurobiological simulation,1990,5
105618,A novel approach to prediction of the 3-dimensional structures of protein backbones by neural networks,1990,5
105622,Training knowledge-based neural networks to recognize genes in DNA sequences,1990,5
105623,Neural network application to diagnostics and control of vehicle control system,1990,5
105625,Lg depth estimation and ripple fire characterization using artificial neural networks,1990,5
105627,A B-P ANN commodity trader,1990,5
105628,Integrated segmentation and recognition of hand-printed numerals,1990,5
105639,SexNet: A neural network identifies sex from human faces,1990,5
105640,A neural expert system with automated extraction of fuzzy if-then rules and its application to medical diagnosis,1990,5
105641,Analog neural networks as decoders,1990,5
105642,Distributed recursive structure processing,1990,5
105645,Translating locative prepositions,1990,5
105649,A short-term memory architecture for the learning of morphophonemic rules,1990,5
105651,Exploiting syllable structure in a connectionist phonology model,1990,5
105652,Language induction by phase transition in dynamical recognizers,1990,5
105653,Discovering discrete distributed representations with iterative competitive learning,1990,5
105654,Direct memory access using two cues: finding the intersection of sets in a connectionist model,1990,5
105656,An attractor neural network model of recall and recognition,1990,5
105658,ALCOVE: a connectionist model of human category learning,1990,5
105659,Spherical units as dynamic consequential regions: implications for attention, competition and categorization,1990,5
105661,Connectionist implementation of a theory of generalization,1990,5
105663,Adaptive spline networks,1990,5
105664,Multi-layer perceptrons with B-spline receptive field functions,1990,5
105666,Bumptrees for efficient function, constraint, and classification learning,1990,5
105667,Basis-function trees as a generalization of local variable selection methods for function approximation,1990,5
105668,Generalization properties of radial basis functions,1990,5
105670,Learning by combining memorization and gradient descent,1990,5
105672,Sequential adaptation of radial basis function neural networks and its application to time-series prediction,1990,5
105674,Oriented non-radial basis functions for image coding and analysis,1990,5
105676,Computing with arrays of bell-shaped and sigmoid functions,1990,5
105677,Discrete affine wavelet transforms for analysis and synthesis of feedforward neural networks,1990,5
105679,Extensions of a theory of networks for approximation and learning: outliers and negative examples,1990,5
105680,How receptive field parameters affect neural learning,1990,5
105682,A competitive modular connectionist architecture,1990,5
105684,Evaluation of adaptive mixtures of competing experts,1990,5
105685,A framework for the cooperation of learning algorithms,1990,5
105687,Connectionist music composition based on melodic and stylistic constraints,1990,5
105689,Using genetic algorithms to improve pattern classification performance,1990,5
105692,Evolution and learning in neural networks: the number and distribution of learning trials affect the rate of evolution,1990,5
105694,Designing linear threshold based neural network pattern classifiers,1990,5
106559,On stochastic complexity and admissible models for neural network classifiers,1990,5
106560,A method for the efficient design of Boltzmann machines for classification problems,1990,5
106561,Note on learning rate schedules for stochastic optimization,1990,5
106562,Convergence of a neural network classifier,1990,5
106563,Learning theory and experiments with competitive networks,1990,5
106564,Transforming neural-net output levels to probability distributions,1990,5
106565,Back propagation is sensitive to initial conditions,1990,5
106566,Closed-form inversion of backpropagation networks: theory and optimization issues,1990,5
106567,Generalization by weight-elimination with application to forecasting,1990,5
106568,The devil and the network: what sparsity implies to robustness and memory,1990,5
106569,Generalization dynamics in LMS trained linear networks,1990,5
106570,Dynamics of generalization in linear perceptrons,1990,5
106571,Constructing hidden units using examples and queries,1990,5
106572,Can neural networks do better than the Vapnik-Chervonenkis bounds?,1990,5
106573,Second order properties of error surfaces: learning time and generalization,1990,5
106574,Chaitin-Kolmogorov complexity and generalization in neural networks,1990,5
106575,Asymptotic slowing down of the nearest-neighbor classifier,1990,5
106576,Remarks on interpolation and recognition using neural nets,1990,5
106577,&egr;-Entropy and the complexity of feedforward neural networks,1990,5
106578,On the circuit complexity of neural networks,1990,5
106579,Comparison of three classification techniques, CART, C4.5 and multi-layer perceptrons,1990,5
106580,A comparative study of the practical characteristics of neural network and conventional pattern classifiers,1990,5
106581,Time trials on second-order and variable-learning-rate algorithms,1990,5
106582,Kohonen networks and clustering: comparative performance in color clustering,1990,5
106583,VLSI implementations of learning and memory systems: a review,1990,5
106584,Compact EEPROM-based weight functions,1990,5
106585,An analog VLSI splining network,1990,5
106586,Relaxation networks for large supervised learning problems,1990,5
106587,Design and implementation of a high speed CMAC neural network using programmable CMOS logic cell arrays,1990,5
106588,Back propagation implementation on the adaptive solutions CNAPS neurocomputer chip,1990,5
106589,Reconfigurable neural net chip with 32K connections,1990,5
106590,Simulation of the neocognitron on a CCD parallel processing architecture,1990,5
106591,VLSI implementation of TInMANN,1990,5
170524,Proceedings of the third European conference on Computer vision (vol. 1),1994,1
170526,Evolutionary fronts for topology-independent shape modeling and recovery,1994,1
170528,Epipolar fields on surfaces,1994,1
170529,Stability and likelihood of views of three dimensional objects,1994,1
170531,Topological reconstruction of a smooth manifold-solid from its occluding contour,1994,1
170532,Optical flow estimation: advances and comparisons,1994,1
170534,Multiple constraints for optical flow,1994,1
170535,Motion field of curves: applications,1994,1
170536,Sufficient image structure for 3-D motion and shape estimation,1994,1
170537,A comparison between the standard Hough transform and the Mahalanobis distance Hough transform,1994,1
170539,Junction classification by multiple orientation detection,1994,1
170541,Following corners on curves and surfaces in the scale space,1994,1
170542,Scale-space properties of quadratic edge detectors,1994,1
170543,A scalar function formulation for optical flow,1994,1
170544,First order optic flow from log-polar sampled images,1994,1
170545,Recursive non-linear estimation of discontinuous flow fields,1994,1
170546,The use of optical flow for the autonomous navigation,1994,1
170547,An image motion estimation technique based on a combined statistical test and spatiotemporal generalised likelihood ratio approach,1994,1
170549,Independent motion segmentation and collision prediction for road vehicles,1994,1
170550,An MRF based motion detection algorithm implemented on analog resistive network,1994,1
170552,Occlusion ambiguities in motion,1994,1
170553,A robust tracking of 3D motion,1994,1
170554,Robust multiple car tracking with occlusion reasoning,1994,1
170556,Shape from motion algorithms: a comparative analysis of scaled orthography and perspective,1994,1
170558,Robust egomotion estimation from affine motion parallax,1994,1
170559,Integrated 3D analysis of flight image sequences,1994,1
170561,Recursive affine structure and motion from image sequences,1994,1
170563,Shape models from image sequences,1994,1
170565,Vibration modes for nonrigid motion analysis in 3D images,1994,1
170566,Applying VC-dimension analysis to object recognition,1994,1
170568,Extraction of groups for recognition,1994,1
170570,Model based pose estimation of articulated and constrained objects,1994,1
170571,Seeing behind occlusions,1994,1
170572,Face recognition: the problem of compensating for changes in illumination direction,1994,1
170573,Learning flexible models from image sequences,1994,1
170574,A direct recovery of superquadric models in range images using recover-and-select paradigm,1994,1
170575,Segmentation and recovery of SHGCs from a real intensity image,1994,1
170576,Recognizing hand gestures,1994,1
170577,Pose refinement of active models using forces in 3D,1994,1
170578,Recovering surface curvature and orientation from texture distortion: a least squares algorithm and sensitivity analysis,1994,1
170579,Direct estimation of local surface shape in a fixating binocular vision system,1994,1
170580,Deriving orientation cues from stereo images,1994,1
170581,Shape-adapted smoothing in estimation of 3-D depth cues from affine distortions of local 2-D brightness structure,1994,1
170726,Utilizing symmetry in the reconstruction of three-dimensional shape from noisy images,1994,1
170728,Consistency and correction of line-drawings, obtained by projections of piecewise planar objects,1994,1
170729,On the enumerative geometry of aspect graphs,1994,1
170730,Geometry-driven curve evolution,1994,1
170731,Quantitative measurement of manufactured diamond shape,1994,1
170732,Hierarchical shape representation using locally adaptive finite elements,1994,1
170733,Camera calibration from spheres images,1994,1
170734,Self calibration of a stereo head mounted onto a robot arm,1994,1
170735,Analytical methods for uncalibrated stereo and motion reconstruction,1994,1
170736,Self-calibration from multiple views with a rotating camera,1994,1
170737,Trilinearity in visual recognition by alignment,1994,1
170738,What can two images tell us about a third one?,1994,1
170739,A robust method for road sign detection and recognition,1994,1
170740,Pose determination and recognition of vehicles in traffic scenes,1994,1
170742,Performance comparison of ten variations on the interpretation-tree matching algorithm,1994,1
170743,Recognition of human facial expressions without feature extraction,1994,1
170744,Pulsed neural networks and perceptive grouping,1994,1
170746,Projective invariants for planar contour recognition,1994,1
170747,Divided we fall: resolving occlusions using causal reasoning,1994,1
170749,Camera calibration of a head-eye system for active vision,1994,1
170750,Linear pushbroom cameras,1994,1
170752,Robust recovery of the epipolar geometry for an uncalibrated stereo rig,1994,1
170753,A stability analysis of the fundamental matrix,1994,1
170755,Canonic representations for the geometries of multiple projective views,1994,1
180651,Proceedings of the third European conference on Computer Vision (Vol. II),1994,1
180652,Active object recognition integrating attention and viewpoint control,1994,1
180653,Active 3D object recognition using 3D affine invariants,1994,1
180654,Grasping the apparent contour,1994,1
180656,Visual tracking of high DOF articulated structures: an application to human hand tracking,1994,1
180657,Integration and control of reactive visual processes,1994,1
180658,Motion estimation on the essential manifold,1994,1
180659,Motion from point matches using affine epipolar geometry,1994,1
180660,Navigation using affine structure from motion,1994,1
180661,A paraperspective factorization method for shape and motion recovery,1994,1
180662,Active camera self-orientation using dynamic image parameters,1994,1
180663,Planning the optimal set of views using the max-min principle,1994,1
180664,On perceptual advantages of eye-head active control,1994,1
180665,Improving registration of 3-D medical images using a mechanical based method,1994,1
180666,Non-iterative contextual correspondence matching,1994,1
180667,A registration method for rigid objects without point matching,1994,1
180668,Non-parametric local transforms for computing visual correspondence,1994,1
180669,Measuring the affine transform using gaussian filters,1994,1
180670,Extracting the affine transformation from texture moments,1994,1
180671,Lack-of-fit detection using the run-distribution test,1994,1
180672,Disparity-space images and large occlusion stereo,1994,1
180673,Registration of a curve on a surface using differential properties,1994,1
180674,Genetic algorithms applied to binocular stereovision,1994,1
180675,Segmentation of echocardiographic images with Markov random fields,1994,1
180676,Unsupervised regions segmentation: real time control of an upkeep machine of natural spaces,1994,1
180677,Synchronous image restoration,1994,1
180678,Parameterfree information-preserving surface restoration,1994,1
180679,Spatially varying illumination: a computational model of converging and diverging sources,1994,1
180680,Recovery of illuminant and surface colors from images based on the CIE daylight,1994,1
180681,3-D stereo using photometric ratios,1994,1
180682,Shape from shading: provably convergent algorithms and uniqueness results,1994,1
180683,Seeing beyond Lambert's law,1994,1
180684,Using 3-dimensional meshes to combine image-based and geometry-based constraints,1994,1
180685,Determination of optical flow and its discontinuities using non-linear diffusion,1994,1
180686,Motion boundary detection in image sequences by local stochastic tests,1994,1
180687,Segmentation of moving objects by robust motion parameter estimation over multiple frames,1994,1
180688,Stochastic motion clustering,1994,1
180689,Association of motion verbs with vehicle movements extracted from dense optical flow fields,1994,1
180690,Comparisons of probabilistic and non-probabilistic Hough transforms,1994,1
180691,Markov random field models in computer vision,1994,1
180692,The role of key-points in finding contours,1994,1
180693,A framework for low level feature extraction,1994,1
180694,Rigid and affine registration of smooth surfaces using differential properties,1994,1
180695,The quadric reference surface: applications in registering views of complex 3D objects,1994,1
