id,title,year,venue_id
812430,Real-Time Wide Area Multi-Camera Stereo Tracking,2005,0
812431,Actions Sketch: A Novel Action Representation,2005,0
812432,A Unified Framework for Tracking through Occlusions and across Sensor Gaps,2005,0
812433,Conformal Deskewing of Non-Planar Documents,2005,0
812434,A Nonlinear Approach for Face Sketch Synthesis and Recognition,2005,0
812435,Semi-Supervised Learning Based Object Detection in Aerial Imagery,2005,0
812436,Image Denoising Using Non-Negative Sparse Coding Shrinkage Algorithm,2005,0
812437,A Statistical Field Model for Pedestrian Detection,2005,0
812438,Detection and Explanation of Anomalous Activities: Representing Activities as Bags of Event n-Grams,2005,0
812439,Tracking Multiple Mouse Contours (without Too Many Samples),2005,0
812440,Correspondence Expansion for Wide Baseline Stereo,2005,0
812441,A Slit Scanning Depth of Route Panorama from Stationary Blur,2005,0
812442,Feature Uncertainty Arising from Covariant Image Noise,2005,0
812443,Fast Illumination-Invariant Background Subtraction Using Two Views: Error Analysis, Sensor Placement and Applications,2005,0
812444,Detecting Doctored Images Using Camera Response Normality and Consistency,2005,0
812445,Towards Complete Generic Camera Calibration,2005,0
812446,Real-Time Connectivity Constrained Depth Map Computation Using Programmable Graphics Hardware,2005,0
812447,Guided Sampling via Weak Motion Models and Outlier Sample Generation for Epipolar Geometry Estimation,2005,0
812448,The Modified pbM-Estimator Method and a Runtime Analysis Technique for the RANSAC Family,2005,0
812449,A Sparse Support Vector Machine Approach to Region-Based Image Categorization,2005,0
812450,On the Localization of Straight Lines in 3D Space from Single 2D Images,2005,0
812451,Implicit Surfaces Make for Better Silhouettes,2005,0
812452,Unsupervised Learning of Object Features from Video Sequences,2005,0
812453,A Tensor Decomposition for Geometric Grouping and Segmentation,2005,0
812454,A Hybrid Graphical Model for Robust Feature Extraction from Video,2005,0
812455,Hybrid Models for Human Motion Recognition,2005,0
812456,Visual Concepts for News Story Tracking: Analyzing and Exploiting the NIST TRECVID Video Annotation Experiment,2005,0
812457,Bayesian Super-Resolution of Text in Video with a Text-Specific Bimodal Prior,2005,0
812458,Robust and Efficient Foreground Analysis for Real-Time Video Surveillance,2005,0
812459,A Direct Method for Modeling Non-Rigid Motion with Thin Plate Spline,2005,0
812460,Cloth Representation by Shape from Shading with Shading Primitives,2005,0
812461,Machine Learning for Clinical Diagnosis from Functional Magnetic Resonance Imaging,2005,0
812462,Colour Constancy Using the Chromagenic Constraint,2005,0
812463,Video Proceedings Welcome,2005,0
812464,Demo Proceedings Welcome,2005,0
812465,Particle Filtering for Geometric Active Contours with Application to Tracking Moving and Deforming Objects,2005,0
812466,Illumination-Invariant Tracking via Graph Cuts,2005,0
812467,Visual Tracking in the Presence of Motion Blur,2005,0
812468,Appearance Modeling for Tracking in Multiple Non-Overlapping Cameras,2005,0
812469,Real-Time Tracking Using Level Sets,2005,0
812470,Higher-Order Image Statistics for Unsupervised, Information-Theoretic, Adaptive, Image Filtering,2005,0
812471,Addressing Radiometric Nonidealities: A Unified Framework,2005,0
812472,A Non-Local Algorithm for Image Denoising,2005,0
812473,Determining the Radiometric Response Function from a Single Grayscale Image,2005,0
812474,A Generative Model of Human Hair for Hair Sketching,2005,0
812475,Active Polyhedron: Surface Evolution Theory Applied to Deformable Meshes,2005,0
812476,Corrected Laplacians: Closer Cuts and Segmentation with Shape Priors,2005,0
812477,Simultaneous Modeling and Tracking (SMAT) of Feature Sets,2005,0
812478,Combining Object and Feature Dynamics in Probabilistic Tracking,2005,0
812479,Localization in Urban Environments: Monocular Vision Compared to a Differential GPS Sensor,2005,0
812480,A Direct Method for 3D Factorization of Nonrigid Motion Observed in 2D,2005,0
812481,Full Body Tracking from Multiple Views Using Stochastic Sampling,2005,0
812482,Automatic 3D to 2D Registration for the Photorealistic Rendering of Urban Scenes,2005,0
812483,Discriminative Training for Object Recognition Using Image Patches,2005,0
812484,Jensen-Shannon Boosting Learning for Object Recognition,2005,0
812485,WaldBoost " Learning for Time Constrained Sequential Detection,2005,0
812486,Formulating Semantic Image Annotation as a Supervised Learning Problem,2005,0
812487,Discriminative Learning of Markov Random Fields for Segmentation of 3D Scan Data,2005,0
812488,Feature Kernel Functions: Improving SVMs Using High-Level Knowledge,2005,0
812489,Coherent Regions for Concise and Stable Image Description,2005,0
812490,Diagram Structure Recognition by Bayesian Conditional Random Fields,2005,0
812491,Fisher+Kernel Criterion for Discriminant Analysis,2005,0
812492,Concurrent Subspaces Analysis,2005,0
812493,Face Synthesis and Recognition from a Single Image under Arbitrary Unknown Lighting Using a Spherical Harmonic Basis Morphable Model,2005,0
812494,2D Statistical Models of Facial Expressions for Realistic 3D Avatar Animation,2005,0
812495,Mercer Kernels for Object Recognition with Local Features,2005,0
812496,A Unified Optimization Based Learning Method for Image Retrieval,2005,0
812497,Robust Object Detection via Soft Cascade,2005,0
812498,Mapping Low-Level Features to High-Level Semantic Concepts in Region-Based Image Retrieval,2005,0
812499,Estimating Disparity and Occlusions in Stereo Video Sequences,2005,0
812500,Generative versus Discriminative Methods for Object Recognition,2005,0
812501,Representational Oriented Component Analysis (ROCA) for Face Recognition with One Sample Image per Training Class,2005,0
812502,Linear Combination Representation for Outlier Detection in Motion Tracking,2005,0
812503,Integrated Learning of Saliency, Complex Features, and Object Detectors from Cluttered Scenes,2005,0
812504,Parameter Estimation for MRF Stereo,2005,0
812505,The Distinctiveness, Detectability, and Robustness of Local Image Features,2005,0
812506,A Semi-Supervised Active Learning Framework for Image Retrieval,2005,0
812507,Optimal Sub-Shape Models by Minimum Description Length,2005,0
812508,Damped Newton Algorithms for Matrix Factorization with Missing Data,2005,0
812509,Object Class Recognition Using Multiple Layer Boosting with Heterogeneous Features,2005,0
812510,Cerebral Vascular Atlas Generation for Anatomical Knowledge Modeling and Segmentation Purpose,2005,0
812511,Flattening Curved Documents in Images,2005,0
812512,Rank-R Approximation of Tensors: Using Image-as-Matrix Representation,2005,0
812513,Higher Order Whitening of Natural Images,2005,0
812514,Region Competition via Local Watershed Operators,2005,0
812515,Tone Reproduction: A Perspective from Luminance-Driven Perceptual Grouping,2005,0
812516,Contrast Enhancement of Multi-Displays Using Human Contrast Sensitivity,2005,0
812517,Stereo Correspondence by Dynamic Programming on a Tree,2005,0
812518,Multi-View Stereo via Volumetric Graph-Cuts,2005,0
812519,Symmetric Stereo Matching for Occlusion Handling,2005,0
812520,Bi-Layer Segmentation of Binocular Stereo Video,2005,0
812521,Imaging the Cardiovascular Pulse,2005,0
812522,Top-Down and Bottom-Up Strategies in Lesion Detection of Background Diabetic Retinopathy,2005,0
812523,Database-Guided Segmentation of Anatomical Structures with Complex Appearance,2005,0
812524,Blob Segmentation Using Joint Space-Intensity Likelihood Ratio Test: Application to 3D Tumor Segmentation,2005,0
812525,Creating Invariance to "Nuisance Parameters" in Face Recognition,2005,0
812526,Face Recognition Based on Frontal Views Generated from Non-Frontal Images,2005,0
812527,Face Verification across Age Progression,2005,0
812528,A High Resolution Grammatical Model for Face Representation and Sketching,2005,0
812529,Hallucinating Faces: TensorPatch Super-Resolution and Coupled Residue Compensation,2005,0
812530,Simultaneous Estimation of Segmentation and Shape,2005,0
812531,Ensemble Tracking,2005,0
812532,Multiple Collaborative Kernel Tracking,2005,0
812533,A Closed Form Solution to Direct Motion Segmentation,2005,0
812534,Optical Flow Estimation and Segmentation of Multiple Moving Dynamic Textures,2005,0
812535,A Bayesian Hierarchical Model for Learning Natural Scene Categories,2005,0
812536,Illumination Normalization for Face Recognition and Uneven Background Correction Using Total Variation Based Image Models,2005,0
812537,Single Image Phase-Based MRI Fat Suppression Expectation Maximization Algorithm,2005,0
812538,Speckle-Constrained Filtering of Ultrasound Images,2005,0
812539,Learning Spatiotemporal T-Junctions for Occlusion Detection,2005,0
812540,Learning Feature Distance Measures for Image Correspondences,2005,0
812541,Recognizing Facial Expression: Machine Learning and Application to Spontaneous Behavior,2005,0
812542,On the Small Sample Performance of Boosted Classifiers,2005,0
812543,Random Subspaces and Subsampling for 2-D Face Recognition,2005,0
812544,ARTag, a Fiducial Marker System Using Digital Techniques,2005,0
812545,Multi-Output Regularized Projection,2005,0
812546,Statistical Cue Integration for Foveated Wide-Field Surveillance,2005,0
812547,Scene-Adapted Structured Light,2005,0
812548,Beyond Lambert: Reconstructing Specular Surfaces Using Color,2005,0
812549,Efficient Image Matching with Distributions of Local Invariant Features,2005,0
812550,Learning Spatiotemporal T-Junctions for Occlusion Detection,2005,0
812551,Moving Cast Shadow Detection from a Gaussian Mixture Shadow Model,2005,0
812552,Isophote Properties as Features for Object Detection,2005,0
812553,Shape Regularized Active Contour Using Iterative Global Search and Local Optimization,2005,0
812554,Integration of Motion Fields through Shape,2005,0
812555,Learning a Multi-Size Patch-Based Hybrid Kernel Machine Ensemble for Abnormal Region Detection in Colonoscopic Images,2005,0
812556,Two-View Multibody Structure-and-Motion with Outliers,2005,0
812557,Probabilistic Modeling-Based Vessel Enhancement in Thoracic CT Scans,2005,0
812558,Level Set Active Contours on Unstructured Point Cloud,2005,0
812559,Accurate Motion Layer Segmentation and Matting,2005,0
812560,Learning the Semantics of Images by Using Unlabeled Samples,2005,0
812561,Object Detection Using 2D Spatial Ordering Constraints,2005,0
812562,Using the Inner-Distance for Classification of Articulated Shapes,2005,0
812563,Classification of Contour Shapes Using Class Segment Sets,2005,0
812564,Part-Based Statistical Models for Object Classification and Detection,2005,0
812565,A Bayesian Mixture Model for Multi-View Face Alignment,2005,0
812566,Learning to Estimate Human Pose with Data Driven Belief Propagation,2005,0
812567,Joint Nonparametric Alignment for Analyzing Spatial Gene Expression Patterns in Drosophila Imaginal Discs,2005,0
812568,Vehicle Fingerprinting for Reacquisition and Tracking in Videos,2005,0
812569,Fast Spatial Pattern Discovery Integrating Boosting with Constellations of Contextual Descriptors,2005,0
812570,Randomized Trees for Real-Time Keypoint Recognition,2005,0
812571,Skeletal Parameter Estimation from Optical Motion Capture Data,2005,0
812572,A Minimal Solution for Relative Pose with Unknown Focal Length,2005,0
812573,Algebraically Accurate Volume Registration Using Euler's Theorem and the 3-D Pseudo-Polar FFT,2005,0
812574,Combining Variable Selection with Dimensionality Reduction,2005,0
812575,Accurate and Efficient Stereo Processing by Semi-Global Matching and Mutual Information,2005,0
812576,A Factorization-Based Approach to Articulated Motion Recovery,2005,0
812577,Modelling Dynamic Scenes by Registering Multi-View Image Sequences,2005,0
812578,Graph Embedding: A General Framework for Dimensionality Reduction,2005,0
812579,Beyond Pairwise Clustering,2005,0
812580,Local Discriminant Embedding and Its Variants,2005,0
812581,Unsupervised Learning in Radiology Using Novel Latent Variable Models,2005,0
812582,Fields of Experts: A Framework for Learning Image Priors,2005,0
812583,Shape from Shading: A Well-Posed Problem?,2005,0
812584,Complex 3D Shape Recovery Using a Dual-Space Approach,2005,0
812585,Bayesian 3D Modeling from Images Using Multiple Depth Maps,2005,0
812586,Visibility Constrained Surface Evolution,2005,0
812587,Asymmetrical Occlusion Handling Using Graph Cut for Multi-View Stereo,2005,0
812588,Inverse Polarization Raytracing: Estimating Surface Shapes of Transparent Objects,2005,0
812589,Camera Calibration and Light Source Estimation from Images with Shadows,2005,0
812590,Locally Adaptive Support-Weight Approach for Visual Correspondence Search,2005,0
812591,Monocular 3-D Tracking of the Golf Swing,2005,0
812592,Energy Minimization via Graph Cuts: Settling What is Possible,2005,0
812593,Theoretical Analysis on Reconstruction-Based Super-Resolution for an Arbitrary PSF,2005,0
812594,Learning and Detecting Activities from Movement Trajectories Using the Hierarchical Hidden Markov Models,2005,0
812595,Nonparametric Subspace Analysis for Face Recognition,2005,0
812596,Audio-Visual Affect Recognition through Multi-Stream Fused HMM for HCI,2005,0
812597,Finding Glass,2005,0
812598,Robust Instantaneous Rigid Motion Estimation,2005,0
812599,Estimating 3D Shape and Texture Using Pixel Intensity, Edges, Specular Highlights, Texture Constraints and a Prior,2005,0
812600,Object Recognition with Features Inspired by Visual Cortex,2005,0
812601,Applying Neighborhood Consistency for Fast Clustering and Kernel Density Estimation,2005,0
812602,Unstructured Point Cloud Matching within Graph-Theoretic and Thermodynamic Frameworks,2005,0
812603,Optimal Point Correspondence through the Use of Rank Constraints,2005,0
812604,Multimodal Face Recognition: Combination of Geometry with Physiological Information,2005,0
812605,Personal Identification Utilizing Finger Surface Features,2005,0
812606,Online Selecting Discriminative Tracking Features Using Particle Filter,2005,0
812607,A Bayesian Approach to Unsupervised Feature Selection and Density Estimation Using Expectation Propagation,2005,0
812608,Tracking Multiple Objects through Occlusions,2005,0
812609,Tracking Non-Stationary Appearances and Dynamic Feature Selection,2005,0
812610,On Modelling Nonlinear Shape-and-Texture Appearance Manifolds,2005,0
812611,A Dense Stereo Matching Using Two-Pass Dynamic Programming with Generalized Ground Control Points,2005,0
812612,A Framework of 2D Fisher Discriminant Analysis: Application to Face Recognition with Small Number of Training Samples,2005,0
812613,Theory for Variational Area-Based Segmentation Using Non-Quadratic Penalty Functions,2005,0
812614,MRF Augmented Particle Filter Tracker,2005,0
812615,Analytically Solving Radial Distortion Parameters,2005,0
812616,Articulated Structure from Motion by Factorization,2005,0
812617,Polarization Multiplexing for Bidirectional Imaging,2005,0
812618,Quantitative Evaluation of a Novel Image Segmentation Algorithm,2005,0
812619,Spectral Segmentation with Multiscale Graph Decomposition,2005,0
812620,Range Data Registration Using Photometric Features,2005,0
812621,Using Coupled Subspace Models for Recovery of Reflectance Spectra from Airborne Images,2005,0
812622,Vehicle Segmentation and Tracking from a Low-Angle Off-Axis Camera,2005,0
812623,Spatiograms versus Histograms for Region-Based Tracking,2005,0
812624,Level Set Based Shape Prior Segmentation,2005,0
812625,A Weighted Nearest Mean Classifier for Sparse Subspaces,2005,0
812626,Tracking Multiple Colored Blobs with a Moving Camera,2005,0
812627,Automatic Thermal Monitoring System (ATHEMOS) for Deception Detection,2005,0
812628,A Projector-Camera System with Real-Time Photometric Adaptation for Dynamic Environments,2005,0
812629,Efficient Real-Time Algorithms for Eye State and Head Pose Tracking in Advanced Driver Support Systems,2005,0
812630,Tracking Multiple Objects through Occlusions,2005,0
812631,8D-THERMO CAM: Combination of Geometry with Physiological Information for Face Recognition,2005,0
812632,Computer Vision for Music Identification: Video Demonstration,2005,0
812633,Skeletal Parameter Estimation from Optical Motion Capture Data,2005,0
812634,Bi-Layer Segmentation of Binocular Stereo Video,2005,0
812635,Hand Tracking with Flocks of Features,2005,0
812636,Object Detection Using 2D Spatial Ordering Constraints,2005,0
812637,Online Modeling and Tracking of Pose-Varying Faces in Video,2005,0
812638,Camera Matchmoving in Unprepared, Unknown Environments,2005,0
812639,Interactive Pinpoint Image Object Removal,2005,0
812640,Interactive Montages of Sprites for Indexing and Summarizing Security Video,2005,0
812641,Geodesic Computation for Adaptive Remeshing,2005,0
812642,Tracking People and Recognizing Their Activities,2005,0
812643,Facial Muscle Activations from Motion Capture,2005,0
812644,Synchronization and Calibration of a Camera Network for 3D Event Reconstruction from Live Video,2005,0
812645,A Markov Random Field Approach for Dense Photometric Stereo,2005,0
812646,Calibration of Pan-Tilt-Zoom (PTZ) Cameras and Omni-Directional Cameras,2005,0
812647,Monocular 3D Tracking of the Golf Swing,2005,0
812648,Face Modeling and Analysis in Stony Brook University,2005,0
812649,Videoshop: A New Framework for Spatio-Temporal Video Editing in Gradient Domain,2005,0
812650,A Flow-Based Approach to Vehicle Detection and Background Mosaicking in Airborne Video,2005,0
812651,A Factorization-Based Approach to Articulated Motion Recovery,2005,0
812652,Driver State Monitor from DELPHI,2005,0
812653,ALIP: The Automatic Linguistic Indexing of Pictures System,2005,0
812654,RGB-Z: Mapping a Sparse Depth Map to a High Resolution RGB Camera Image,2005,0
829211,Advances in Neural Information Processing Systems 17: Proceedings of the 2004 Conference (Bradford Books),2005,5
836198,Proceedings of the Tenth IEEE International Conference on Computer Vision (ICCV'05) Volume 1 - Volume 01,2005,2
836199,Proceedings of the Tenth IEEE International Conference on Computer Vision - Volume 2,2005,2
836669,Segmentation of Hybrid Motions via Hybrid Quadratic Surface Analysis,2005,2
836670,Detection and Tracking of Moving Objects from a Moving Platform in Presence of Strong Parallax,2005,2
836671,Simultaneous Multiple 3D Motion Estimation via Mode Finding on Lie Groups,2005,2
836672,Separating Transparent Layers of Repetitive Dynamic Behaviors,2005,2
836673,Learning Layered Motion Segmentation of Video,2005,2
836674,On the Spatial Statistics of Optical Flow,2005,2
836675,Sparse Image Coding Using a 3D Non-Negative Tensor Factorization,2005,2
836676,Perceptual Scale Space and its Applications,2005,2
836677,Active Search for Real-Time Vision,2005,2
836678,Fast Recognition of Multi-View Faces with Feature Selection,2005,2
836679,Detection of Multiple, Partially Occluded Humans in a Single Image by Bayesian Combination of Edgelet Part Detectors,2005,2
836680,Combining Image Regions and Human Activity for Indirect Object Recognition in Indoor Wide-Angle Views,2005,2
836681,A Semi-Supervised Framework for Mapping Data to the Intrinsic Manifold,2005,2
836682,Registration of Multimodal Fluorescein Images Sequence of the Retina,2005,2
836683,Kernel-Based Multifactor Analysis for Image Synthesis and Recognition,2005,2
836684,Non-Parametric Self-Calibration,2005,2
836685,Basic Gray Level Aura Matrices: Theory and its Application to Texture Synthesis,2005,2
836686,Combining Generative Models and Fisher Kernels for Object Recognition,2005,2
836687,Exploring the Space of a Human Action,2005,2
836688,Recognizing Human Actions in Videos Acquired by Uncalibrated Moving Cameras,2005,2
836689,Hilbert Functions and Applications to the Estimation of Subspace Arrangements,2005,2
836690,Efficient Visual Event Detection Using Volumetric Features,2005,2
836691,An Algebraic Approach to Surface Reconstruction from Gradient Fields,2005,2
836692,On Optimizing Template Matching via Performance Characterization,2005,2
836693,Mutual Information Regularized Bayesian Framework for Multiple Image Restoration,2005,2
836694,Is ICA Significantly Better than PCA for Face Recognition?,2005,2
836695,Prior-Based Segmentation by Projective Registration and Level Sets,2005,2
836696,Fast Multiple Object Tracking via a Hierarchical Particle Filter,2005,2
836697,Feature Hierarchies for Object Classification,2005,2
836698,Using Frontier Points to Recover Shape, Reflectance and Illumunation,2005,2
836699,Multi-Scale Gesture Recognition from Time-Varying Contours,2005,2
836700,Integrated Spatial and Frequency Domain 2D Motion Segmentation and Estimation,2005,2
836701,Shape Parameter Optimization for AdaBoosted Active Shape Model,2005,2
836702,A Multilevel Banded Graph Cuts Method for Fast Image Segmentation,2005,2
836703,A Practical Single Image Based Approach for Estimating Illumination Distribution from Shadows,2005,2
836704,3D Object Reconstruction from a Single 2D Line Drawing without Hidden Lines,2005,2
836705,Robust Path-Based Spectral Clustering with Application to Image Segmentation,2005,2
836706,Building a Classification Cascade for Visual Identification from One Example,2005,2
836707,A Unifying Approach to Hard and Probabilistic Clustering,2005,2
836708,Probabilistic Contour Extraction Using Hierarchical Shape Representation,2005,2
836709,Multi-View Surface Reconstruction Using Polarization,2005,2
836710,Degenerate Cases and Closed-form Solutions for Camera Calibration with One-Dimensional Objects,2005,2
836711,Using Extended Light Sources for Modeling Object Appearance under Varying Illumination,2005,2
836712,Detection of Concentric Circles for Camera Calibration,2005,2
836713,Shape and Spatially-Varying BRDFs from Photometric Stereo,2005,2
836714,Multi-View Reconstruction Using Photo-consistency and Exact Silhouette Constraints: A Maximum-Flow Formulation,2005,2
836715,Avoiding the "Streetlight Effect": Tracking by Exploring Likelihood Modes,2005,2
836716,A Theoretical Limit on the Number of Effective Pixels that can be Optically Resolved on a Non-Planar Subject,2005,2
836717,Discovering Objects and their Localization in Images,2005,2
836718,Vehicle Identification between Non-Overlapping Cameras without Direct Feature Matching,2005,2
836719,High Resolution Tracking of Non-Rigid 3D Motion of Densely Sampled Data Using Harmonic Maps,2005,2
836720,A Stochastic Filter for Fluid Motion Tracking,2005,2
836721,Priors for People Tracking from Small Training Sets,2005,2
836722,Discontinuity Preserving Stereo with Small Baseline Multi-Flash Illumination,2005,2
836723,Structured Light in Scattering Media,2005,2
836724,Globally Optimal Solutions for Energy Minimization in Stereo Vision Using Reweighted Belief Propagation,2005,2
836725,BRDF Invariant Stereo Using Light Transport Constancy,2005,2
836726,Vector Boosting for Rotation Invariant Multi-View Face Detection,2005,2
836727,Closely Coupled Object Detection and Segmentation,2005,2
836728,Detecting Irregularities in Images and in Video,2005,2
836729,Beyond Trees: Common-Factor Models for 2D Human Pose Recovery,2005,2
836730,A Bayesian Approach for Shadow Extraction from a Single Image,2005,2
836731,Shape Classifer Based on Generalized Probabilistic Descent Method with Hidden Markov Descriptor,2005,2
836732,8-Point Algorithm Revisited: Factorized 8-Point Algorithm,2005,2
836733,Contour-Based Learning for Object Detection,2005,2
836734,Multi-View AAM Fitting and Camera Calibration,2005,2
836735,Using Eye Reflections for Face Recognition Under Varying Illumination,2005,2
836736,Real-Time Interactively Distributed Multi-Object Tracking Using a Magnetic-Inertia Potential Model,2005,2
836737,Mutual Information-Based 3D Surface Matching with Applications to Face Recognition and Brain Mapping,2005,2
836738,Image Based Regression Using Boosting Method,2005,2
836739,Efficient Block Noise Removal Based on Nonlinear Manifolds,2005,2
836740,Improved Sub-pixel Stereo Correspondences through Symmetric Refinement,2005,2
836741,What Metrics Can Be Approximated by Geo-Cuts, Or Global Optimization of Length/Area and Flux,2005,2
836742,Incorporating Visual Knowledge Representation in Stereo Reconstruction,2005,2
836743,Multiperspective Projection and Collineation,2005,2
836744,Recovering Facial Shape and Albedo Using a Statistical Model of Surface Normal Direction,2005,2
836745,Linear Approaches to Camera Calibration from Sphere Images or Active Intrinsic Calibration Using Vanishing Points,2005,2
836746,Creating Efficient Codebooks for Visual Recognition,2005,2
836747,Photometric Stereo under Perspective Projection,2005,2
836748,An Expectation Maximization Approach to the Synergy between Image Segmentation and Object Categorization,2005,2
836749,Fundamental Matrix for Cameras with Radial Distortion,2005,2
836750,KALMANSAC: Robust Filtering by Consensus,2005,2
836751,Mixtures of Dynamic Textures,2005,2
836752,Manifold Clustering,2005,2
836753,Geometric Context from a Single Image,2005,2
836754,Opaque Document Imaging: Building Images of Inaccessible Texts,2005,2
836755,An Integrated Framework for Image Segmentation and Perceptual Grouping,2005,2
836756,Learning a Sparse, Corner-Based Representation for Time-varying Background Modeling,2005,2
836757,How Hard is 3-View Triangulation Really?,2005,2
836758,Fixed Point Probability Field for Complex Occlusion Handling,2005,2
836759,Visual Learning Given Sparse Data of Unknown Complexity,2005,2
836760,Patch Based Blind Image Super Resolution,2005,2
836761,Bi-Directional Tracking Using Trajectory Segment Analysis,2005,2
836762,Bayesian Body Localization Using Mixture of Nonlinear Shape Models,2005,2
836763,TemporalBoost for Event Recognition,2005,2
836764,Detection, Analysis and Matching of Hair,2005,2
836765,Robust Structure from Motion and Identified Dynamics,2005,2
