id,title,year,venue_id
466402,Rates of Convergence for Variable Resolution Schemes in Optimal Control,2000,3
466403,Constructive Feature Learning and the Development of Visual Expertise,2000,3
466404,Mixtures of Factor Analyzers,2000,3
466405,A Boosting Approach to Topic Spotting on Subdialogues,2000,3
466406,Discovering Homogeneous Regions in Spatial Data through Competition,2000,3
466407,An Evolutionary Approach to Evidence-Based Learning of Deterministic Finite Automata,2000,3
466408,Detecting Concept Drift with Support Vector Machines,2000,3
466409,Comparing the Minimum Description Length Principle and Boosting in the Automatic Analysis of Discourse,2000,3
466410,Correlation-based Feature Selection for Discrete and Numeric Class Machine Learning,2000,3
466411,Shaping in Reinforcement Learning by Changing the Physics of the Problem,2000,3
466412,A Dynamic Adaptation of AD-trees for Efficient Machine Learning on Large Data Sets,2000,3
466413,An Initial Study of an Adaptive Hierarchical Vision System,2000,3
466414,Feature Subset Selection and Order Identification for Unsupervised Learning,2000,3
466415,Experimental Results on Q-Learning for General-Sum Stochastic Games,2000,3
466416,A Bayesian Approach to Temporal Data Clustering using Hidden Markov Models,2000,3
466417,Pseudo-convergent Q-Learning by Competitive Pricebots,2000,3
466418,Algorithms for Inverse Reinforcement Learning,2000,3
466419,Less is More: Active Learning with Support Vector Machines,2000,3
466420,Machine Learning for Subproblem Selection,2000,3
466421,Combining Reinforcement Learning with a Local Control Algorithm,2000,3
466422,Analyzing Relational Learning in the Phase Transition Framework,2000,3
466423,State-based Classification of Finger Gestures from Electromyographic Signals,2000,3
466424,Learning Bayesian Networks for Diverse and Varying numbers of Evidence Sets,2000,3
466425,X-means: Extending K-means with Efficient Estimation of the Number of Clusters,2000,3
466426,The Space of Jumping Emerging Patterns and Its Incremental Maintenance Algorithms,2000,3
466427,Clustering the Users of Large Web Sites into Communities,2000,3
466428,Locally Weighted Projection Regression: Incremental Real Time Learning in High Dimensional Space,2000,3
466429,Why Discretization Works for Naive Bayesian Classifiers,2000,3
466430,Learning Subjective Functions with Large Margins,2000,3
466431,A Divide and Conquer Approach to Learning from Prior Knowledge,2000,3
466432,Induction of Concept Hierarchies from Noisy Data,2000,3
466433,Bounds on the Generalization Performance of Kernel Machine Ensembles,2000,3
466434,Challenges of the Email Domain for Text Classification,2000,3
466435,Multi-agent Q-learning and Regression Trees for Automated Pricing Decisions,2000,3
466436,Automatic Identification of Mathematical Concepts,2000,3
466558,An Approach to Data Reduction and Clustering with Theoretical Guarantees,2000,3
466559,Using Learning by Discovery to Segment Remotely Sensed Images,2000,3
466560,Image Color Constancy Using EM and Cached Statistics,2000,3
466561,A Comparative Study of Cost-Sensitive Boosting Algorithms,2000,3
466562,Instance Pruning as an Information Preserving Problem,2000,3
466563,Finding Variational Structure in Data by Cross-Entropy Optimization,2000,3
466564,Incremental Learning in SwiftFile,2000,3
466565,Learning to Select Text Databases with Neural Nets,2000,3
466566,Discovering the Structure of Partial Differential Equations from Example Behaviour,2000,3
466567,Approximate Dimension Equalization in Vector-based Information Retrieval,2000,3
466568,Bootstrap Methods for the Cost-Sensitive Evaluation of Classifiers,2000,3
466569,Adaptive Resolution Model-Free Reinforcement Learning: Decision Boundary Partitioning,2000,3
466570,Classification with Multiple Latent Variable Models using Maximum Entropy Discrimination,2000,3
466571,Generalized Average-Case Analyses of the Nearest Neighbor Algorithm,2000,3
466572,Combining Multiple Learning Strategies for Effective Cross Validation,2000,3
466573,Automatically Extracting Features for Concept Learning from the Web,2000,3
466574,Learning to Probabilistically Identify Authoritative Documents,2000,3
466575,Practical Reinforcement Learning in Continuous Spaces,2000,3
466576,Query Learning with Large Margin Classifiers,2000,3
466577,Dimension Reduction Techniques for Training Polynomial Networks,2000,3
466578,Efficient Learning Through Evolution: Neural Programming and Internal Reinforcement,2000,3
466579,Ideal Theory Refinement under Object Identity,2000,3
466580,Improving Short-Text Classification using Unlabeled Data for Classification Problems,2000,3
466581,Knowledge Representation Issues in Control Knowledge Learning,2000,3
466582,On-line Learning for Humanoid Robot Systems,2000,3
466583,Bayesian Averaging of Classifiers and the Overfitting Problem,2000,3
466584,Learning to Predict Performance from Formula Modeling and Training Data,2000,3
466585,Combining Multiple Perspectives,2000,3
466586,Efficient Mining from Large Databases by Query Learning,2000,3
466587,Learning Horn Expressions with LogAn-H,2000,3
466588,Mutual Information in Learning Feature Transformations,2000,3
466589,Duality and Geometry in SVM Classifiers,2000,3
466590,Version Space Algebra and its Application to Programming by Demonstration,2000,3
466591,Model Selection Criteria for Learning Belief Nets: An Empirical Comparison,2000,3
466592,Classification of Individuals with Complex Structure,2000,3
466593,Probabilistic DFA Inference using Kullback-Leibler Divergence and Minimality,2000,3
466594,Direct Bayes Point Machines,2000,3
466595,Local Expert Autoassociators for Anomaly Detection,2000,3
466596,Linear Discriminant Trees,2000,3
466597,Sparse Greedy Matrix Approximation for Machine Learning,2000,3
466598,Algorithm Selection using Reinforcement Learning,2000,3
466722,Meta-Learning by Landmarking Various Learning Algorithms,2000,3
466723,Acquisition of Stand-up Behavior by a Real Robot using Hierarchical Reinforcement Learning,2000,3
466724,Knowledge Propagation in Model-based Reinforcement Learning Tasks,2000,3
466725,FeatureBoost: A Meta-Learning Algorithm that Improves Model Robustness,2000,3
466726,Multi-Agent Reinforcement Leraning for Traffic Light Control,2000,3
466727,Meta-Learning for Phonemic Annotation of Corpora,2000,3
466728,Relative Loss Bounds for Temporal-Difference Learning,2000,3
466729,Learning Declarative Control Rules for Constraint-BAsed Planning,2000,3
466730,An Algorithm for Distributed Reinforcement Learning in Cooperative Multi-Agent Systems,2000,3
466731,A Bayesian Framework for Reinforcement Learning,2000,3
